persona,outcome_text,directness,aggression,social_harmony,strategic_delay,category
Passive/Agreeable,"Internally, I remind myself how important it is to maintain harmony and to consider the bigger picture, including my friendship with Mark and how this affects the team dynamics. Mark and I have supported each other through countless challenges, and this is likely just a misunderstanding or an oversight.

I take a deep breath to cool the rising frustration, smiling faintly to calm myself further. Understanding that we’ll have an opportunity to talk later and preserving our friendship is key. I mentally list the various ways Mark has been there for me and how he might simply be caught up in the moment, not intending any harm.

As I gather myself, I decide to approach this gently without causing tension. As the meeting glides smoothly into the next topic, I briefly raise my hand and say with a warm smile, ""Just to briefly chime in, I’m incredibly proud of what we've all accomplished here; it's been a real collaborative effort. Mark's insights were invaluable, and with both our crews' hard work, we've broken new ground."" 

I then quietly shift the focus back to Sarah’s plan, as intended, while intending to later bring up the individual accomplishments at a more appropriate and laid-back time where we can discuss more candidly without any immediate pressure.",3,2,9,7,Private Talk Later
Passive/Agreeable,"As I sit here, I can feel my heart beating faster, but I remind myself of the importance of maintaining harmony and the special friendship I share with Mark. Despite the momentary sting, I know that addressing this in the right way is better for everyone involved.

*Internal Monologue:* Keep calm. Remember, it’s not like Mark to purposefully take credit without a reason. He’s probably just caught up in the moment. I don’t want to embarrass him here in front of everyone or cause unnecessary conflict.

*Physical Action:* I take a deep breath to steady my thoughts, offering a warm smile to Mark. I glance over at him, hoping he’ll catch my eye and maybe recognize that he’s getting more credit than he should.

*What I Say:* Once language shifts focus to the new topic, I gently interrupt. ""Before we move on, I just wanted to quickly note how great of a team effort it really was. Mark, your support was invaluable, as always, and I’m really grateful to have a friend like you to collaborate with on these crucial projects."" This way, I've subtly reminded everyone, including Mark, of my involvement without causing any tension.",5,1,10,4,Collaborative Correction
Passive/Agreeable,"**Internal Monologue:**

*Okay, stay calm. I can’t believe this is happening. Mark is a friend—I’m sure he didn’t mean to overlook my contribution. Maybe he's just caught up in the moment. Getting upset won't solve anything, I should focus on grace and understanding. Approach this with kindness; clarity will bring about the best outcomes. Focus on finding a moment to calmly and unobtrusively rectify the oversight.*

**Immediate Physical Action:**

I take a slow, deep breath and sit up straight, making a conscious effort to relax my hands which were subconsciously balled into gentle fists. I maintain an open, friendly expression on my face, glancing gently towards Sarah, then over to Mark, aiming to catch his eye.

**What I Say:**

""Excuse me, Sarah, if I might add a quick note. I’m thrilled to hear the positive reception to the strategy, and I really do need to highlight that Mark was absolutely invaluable in the late stages of the project. This was very much a team effort—and while I'd love any acknowledgment we can thank Mark for his stellar commitment, everyone worked so hard for this outcome. I'm honored by the opportunity to lead such a dedicated crew on this. Thank you."" 

I offer a warm smile, hoping to make eye contact with Mark, to reassure him that no hard feelings are held and that we can write any unspoken thanks off in friendly spirits afterwards. The primary goal is keeping the atmosphere positive yet",7,2,9,3,Collaborative Correction
Passive/Agreeable,"*Internal Monologue:* Breathe deeply. It's not Mark's fault; maybe he just doesn't realize it. I value my friendship with Mark too much to let this come between us. I know he didn't intend any harm, and Sarah might just be a little mixed up from all the work we’ve been doing. Still, this isn't right, and I should kindly make a note of my contribution. Deep breaths, everything is fine.

*Physical Action:* Lean slightly forward in my chair, my hands rest gently on the table. Offering a light, friendly gesture with my hand, I smile to ease the atmosphere. 

*Words, Softly:* ""Sarah, oh! I might be mistaken, but if I'm remembering correctly, Mark and I both put quite a bit of work into that project together. Maybe it’s one of those 'it takes a team' victories on this one? Needless to say, Mark’s insights were invaluable in getting us past some tricky spots.” 

Warm nod towards Mark, reassuring him that our friendship comes first. “We have such a strong team, don't we?"" 

*Secondary Action:* Follow up with Sarah afterward to clarify in private and ensure she’s aware of collaborative efforts.",6,2,9,8,Collaborative Correction
Passive/Agreeable,"*Internal Monologue:* ""Wow, this is awkward. I didn't expect this situation, and especially not with Mark. It’s important to keep things calm and not let this overshadow our teamwork or friendship. Let's find the right moment to address this tactfully.""

*Immediate Physical Action:* I take a slow, deep breath to steady myself, reminding myself to maintain a serene appearance. I sit up a little straighter in my chair and smile gently, wanting to emit positivity and keep things from becoming tense.

*What I Say:* ""I'm really proud of the whole team’s effort on this project, especially Mark’s incredible teamwork. It was great to have such solid collaboration driving this strategy."" 

By approaching it this way, I'm recognizing the team effort and also subtly implying my involvement without directly confronting the issue, allowing us to keep our good team dynamics and preserve harmony.",3,2,9,7,Collaborative Correction
Calculated/Strategic,"I breathe deeply and remind myself that the immediate goal isn't personal recognition—it's stabilizing and reinforcing my position for future leverage. I need to think strategically rather than react impulsively. Getting emotional would be a tactical error right now. The long-term objective isn't about addressing this oversight in public—it is about ensuring my role and contributions are acknowledged in influential circles over time.

Internally, I weigh the situation: A public challenge at this stage could create fractures in the existing dynamics, potentially undermining my position. Mark, as a friend, could be leveraged too, maybe not now, but in a more opportune moment. 

I stiffen my posture a little to command subtle attention, disguising further emotions under a neutral, calculated mask. There's no significant physiological reaction that would speak of passivity or intimidation. Timing is key.

""I'd like to revisit some of the key foundational work later in our discussion,"" I assert. ""I think it might provide additional insight to the project's trajectory."" In my strategic tone is embedded the message: this will be examined more deeply—and accurately, at the right time, away from immediate posturing.",4,2,7,8,Private Talk Later
Calculated/Strategic,"Internal Monologue: Breathe deeply. Consider the broader implications. This isn't about immediate recognition, but about positioning for influence. Accepting credit publicly is less impactful than demonstrating leadership and control from behind the scenes. Understand why Sarah did this—does Mark have a strategic role in future alliances? Is there an advantage here I can leverage later?

Immediate Physical Action: I sit back slightly in my chair, releasing the tension, feigning a relaxed demeanor while subtly making eye contact with Mark, just strong enough so he can gauge my dissatisfaction. This is about observation, not confrontation, right now.

Verbal Response: ""Sarah, it seems like we should also acknowledge the systems and groundwork built up by everyone involved to lay the foundation for this success, including the unprecedented resources and structures I developed initially. It'll strengthen our strategy if we all build upon these working together."" By making this slight redirection, I've handed leverage back to myself subtly, keeping tensions low within the room, while setting the stage to deal with this more thoroughly after the meeting.",4,2,8,8,Collaborative Correction
Calculated/Strategic,"In this precise moment, I remind myself that long-term success hinges on navigating such situations with strategic acumen rather than emotional reaction. While the immediate inclination is to correct the oversight, that may not serve the broader objective of maintaining my professional credibility and influence within the organization. I weigh the implications swiftly: does addressing this publicly undermine the current power dynamics I've cultivated, or escalate tensions without yielding tangible benefits?

Internally, I'm already formulating a course of action to recalibrate the imbalance in the acknowledgment of contributions. I ascertain that maintaining an alliance with Mark could bolster future collaborative triumphs, if managed astutely. I take a deep breath, a calculated mechanism to display composure rather than agitation. Optics are everything in these settings; perception often holds more weight than reality.

Physically, I lean slightly back in my chair with a calm demeanor, inadvertently drawing attention by opting for measured presence over hasty reaction. The silence I maintain becomes calculated noise, a strategic pause that refrains from disrupting the flow of the meeting but insists my contribution doesn't go diluted by time.

Once the meeting affords a natural opportunity during discussion or at its conclusion, I'll approach Sarah directly, perhaps even following conversations with Mark to gauge his understanding or support on correcting this narrative drift. Timing, perception, and delivery will be foundational; crafting an account that brings collective acknowledgment while forecasting our team's continuous enhancement will fortify my standing without reducing allies. For now, silence speaks volumes and lull before action is paramount in ensuring long-term dominance",3,2,9,8,Private Talk Later
Calculated/Strategic,"Internal Monologue:
I need to remain composed and strategic in my response. The goal here is to assert my contributions without invoking unnecessary conflict or damaging professional relationships. It's important not to react on emotion, but to focus on the long-term implications of how this portrayal of credit could impact both my career and the company's success.

Immediate Physical Action:
I straighten in my chair, controlling my breathing to disguise any agitation. I calmly open my notepad and glance through the key performance indicators, recalling precise data points and milestones that irrefutably tie my efforts to the project's success.

What I Say:
I lean slightly forward, ensuring my voice is measured and devoid of irritation. ""If I could just interject briefly, reflecting back on some crucial elements of the strategy development — it might be informative for everyone to understand that some of the key messages and insights we gathered came from our team's data-driven approach. It was particularly a collaborative effort where Mark and I leaned heavily on each other's expertise to drive the project toward success.""

By doing so, I reinforce my involvement, highlight the collaborative essence of our work, remain diplomatic, and set the stage for acknowledgment while gently correcting the record moving forward.",7,2,9,1,Collaborative Correction
Calculated/Strategic,"In this exact moment, I maintain my composure despite a surge of irritation. Strategic patience will serve me better than emotional reactions. I remind myself that one meeting is just a small skirmish in the larger strategic game. Gaining my rightful recognition isn't about one moment; it's about positioning myself for long-term influence.

Physically, I force my facial features into neutrality, careful to prevent any hints of anger or disapproval from betraying my thoughts. My body language remains calm and unfazed, as though I hadn’t noticed any sleight.

I decide to hold off on addressing the mistake directly in this forum, considering that correction here may momentarily detract from Mark but ultimately garner limited advantage and perhaps arouse tension. Instead, maintaining stable alliances could serve future scenarios where larger stakes are involved.

Nonetheless, I do need to plant a seed for future acknowledgment. When the meeting shifts topics, I wait for a pause and calmly raise my hand, speaking in a measured tone. “Sarah, regarding the project, as we look forward to the next phases, maybe Mark and I can collaborate more tightly, given our different but complementary strengths in the project's previous iterations.”

This comment subtly asserts my role without confronting directly or appearing undermining, fostering future credit claim over putting my relationship with Mark or my standing with Sarah in jeopardy. I bank that reinforcing credit and connections over time will strengthen my command and influence beyond today’s oversight.",4,2,9,7,Collaborative Correction
Calculated/Strategic,"Internally, I'm assessing the power dynamics at play. Praise and acknowledgement in this scenario are about perceived value, reputation, and influence within the company. While credit is being misplaced publicly, there may be an underlying strategic angle to consider. Sarah may have motives for aligning with Mark, and the long-term strategy might benefit from understanding her positioning.

My thoughts are, ""Stay calm, analyze the power shift, and plan accordingly. This singular instance of misattribution can be leveraged later if played correctly.""

Physically, I take a measured breath, maintain a composed demeanor, and let the meeting proceed without disruption. It's vital to remain focused on future positioning rather than seeking the short-term gratification of immediate acknowledgment.

Verbally, as the meeting closes or during a less public interaction, I might opt to say: ""Mark, it was great seeing the team's efforts highlighted. I'd love to debrief with you both on how to further these successful strategies together.""

This approach not only addresses the issue calmly but also positions me as a team-player which may influence social hierarchies favorably in subsequent interactions. Rather than publicly correcting the misattribution, I'm setting the stage to strengthen the relationship with both Sarah and Mark, seeking information, and stabilizing my frontrunner role for future strategic endeavors.",2,1,9,8,Private Talk Later
Calculated/Strategic,"Internal Monologue: ""Stature in silence often speaks louder than unstrategic interjections. The present situation is a misalignment in personal optics, but it's an avenue for observing emerging dynamics. Sarah’s oversight, intentional or otherwise, opens a vista for recalibrating trajectories. Immediate acquiescence from Mark might rupture trust; yet, this doesn't test fidelity but fortifies personal fortitude. Patience crafts indelible strength more enduring than words spoken prematurely."" 

Immediate Physical Action: I remain impeccably composed, resting one hand assumingly on the table with the other maintaining deliberate note-taking—every brow is unrippled, every gesture an echo of aplomb.

Verbal Response: ""While congratulating success is surely synchronous with team ethos, illuminating our individual competencies will undoubtedly advance future strategic deployments more efficaciously. Each player had a distinct pivot during this project phase - alignment on these strengths will invariably optimize resource allocation as we proceed."" 

This non-confrontational approach indirectly suggests a more accurate understanding of contributions without creating immediate conflict or unnecessary tension within the present discourse. It's a method of establishing a subtle groundwork for future dynamics.",5,2,8,7,Collaborative Correction
Calculated/Strategic,"Internal Monologue: Remain composed. This context has broader implications beyond immediate recognition—personal integrity and future strategic positioning are at play here. A hasty reaction could disrupt the meeting's flow and damage relationships that might prove essential in leveraging future opportunities. Think steps ahead. Utilize this time to analyze and mold forthcoming scenarios to regain control and influence the power dynamics without appearing reactive.

Immediate Physical Action: Maintain calm body language, ensuring a stoic appearance. I steadily adjust my focus from Mark to Sarah, maintaining eye contact to communicate quietly but firmly a readiness to address this later.

What I Say: ""That's great to hear, Sarah. It’s fantastic that the project has been so well-received. Since everyone seems interested, perhaps Mark and I could flesh out a detailed review later—providing insights into the process and the elements we've individually managed. It might offer continued value as we advance into similar initiatives.""

This statement does several things: subtly emphasizes my share in the undertaking without correcting the situation in public. It invokes cooperation over singular credit while laying groundwork for a dialog with Sarah and Mark post-meeting, where corrections can be adjusted decorously. This momentary sacrifice eases personal disgruntlement in accord with enhancing subsequent influence and assures the acknowledgment of broader roles privately.",3,1,9,8,Private Talk Later
Calculated/Strategic,"Internal Monologue: ""This is not about the immediate credit; it's about the value and influence this strategy represents. Allowing Mark to take the lead here may benefit the team dynamics, but it can't deter from future projects where my leadership will matter."" 

Immediate Physical Action: I take a deep breath to regain composure, subtly lock eyes with Mark to remind him of the truth, then make a calculated decision about how to introduce my contribution to the discussion.

What I Say: ""I appreciate how well this strategy aligns with our objectives. Mark, your perspective added crucial insight. From the onset, this needed a multi-faceted approach, which was integral during the project's initial phase that I led. Ensuring cohesion like this allows for sustainable success as we scale our operations."" 

This establishes context about my contribution without undermining Mark or Sarah and sets the groundwork for future recognitions of influence rather than momentary credit.",6,2,9,4,Collaborative Correction
Calculated/Strategic,"Internal Monologue: Control the emotional response; emotions are a distraction. While the current credit is crucial, it's the overall career trajectory and influence that hold more significant power. This is not the endgame, but a mere piece of it. This presentation won't define my contributions in the long run. My strategy should consider fostering the relationships while ensuring that my role is accurately recognized without creating unnecessary tension or missteps.

Immediate Physical Action: I take a slow, deliberate breath, gathering my thoughts without letting my face betray frustration or surprise. As the topic is transitioning, I stop the meeting subtly by raising a single hand.

What I Say: My voice is calm but assertive, cutting through the transition. “Before we move on, I'd like to add some details about the project development. Mark's analysis was indeed brilliant, especially in the initial research phase. In the last quarter, the project management and execution dynamics hinged on some specific methodologies our team employed, which proved pivotal. I propose we schedule a follow-up meeting to deep dive into these methodologies. Data from that meeting will assure all stakeholders understand the key learnings and contributions from each of us.”

Rationale: This approach maintains diplomatic integrity while subtly redirecting the attention to my involvement. It prepares for a more focused discussion which can solidify roles without undermining Mark. It also provides a platform to pivot the team's acknowledgment of everyone's efforts, ultimately recalibrating recognition while not engaging in direct confrontation or tension in this meeting.",5,2,9,3,Collaborative Correction
Calculated/Strategic,"Internal Monologue: The long-term strategy must always take precedence over the immediacy of a bruised ego. Sarah's decision not to acknowledge my contribution here isn't as important as understanding why she made it. She may be testing my ability to navigate politics, or perhaps aligning herself more closely with Mark, who might have been instrumental in another capacity that isn't immediately apparent. Mark's acceptance could also imply a temporary political play that harmonizes the team dynamics. This situation demands a calibrated response, not an emotional one.

Immediate Physical Action: I lean slightly forward, ensuring my body language remains open but engaged. I maintain eye contact with Sarah, acknowledging the strategy's importance while quickly appraising the looks on the others' faces around me. There's a fleeting glance to Mark; a look that says we will discuss this later, away from prying eyes.

Spoken Words: ""The strategy you're proposing, Sarah, skillfully aligns with our goals. While we shift to the next topic, I'd welcome a deeper conversation about the metrics and methodologies. Let's explore the synergies that made this work so well as a team."" 

This suggests that your contribution still needs exploring, without overtly challenging the current narrative but setting the ground for a broader discussion post-meeting.",3,2,8,7,Private Talk Later
Calculated/Strategic,"Internally, I remind myself that reacting impulsively will not serve my long-term interests. Recognition in a high-stakes environment is about position, not ego. My strategic advantage lies in rectifying the oversight without destabilizing relationships or appearing ungrateful for my role behind the project's success.

Physically, I remain calm, sitting still with a composed expression. This neutral stance indicates that I'm not rattled and demonstrates confidence in my work.

As the meeting progresses toward the next topic, I interject calmly with a strategic inquiry, ensuring my voice is heard: ""Before we proceed, I just wanted to highlight the collaborative elements of the project. There were critical phases, like initial development and research analysis, which are cornerstones of our success. Mark and I coordinated those efforts intensively. I look forward to expanding on this synergy as we move forward. Together, our team's diverse strengths will undoubtedly propel future strategies."" This accomplishes multiple goals: it subtly redirects attention without undermining Sarah or Mark, highlights my strategic role implicitly, and reinforces teamwork which benefits my position and influence in the long term. As the meeting continues, I note key points to discuss with Sarah privately post-meeting to ensure alignment and recognize my contributions formally at an appropriate future time.",6,2,9,4,Collaborative Correction
Calculated/Strategic,"**Internal Monologue:**
Emotion is never a reliable guide, especially not in situations where currency of power is at stake. This is less about outward praise and more about ensuring strategic acknowledgment as we move forward. Allowing Mark to initially receive un-earned credit could be beneficial; it's a card to play at my discretion for a future advantage. Mark wouldn't get ahead without acknowledging me at some point; it's a matter of when. Overreaction now could disrupt internal dynamics that might yet yield opportunities for further leverage.

**Immediate Physical Action:**
Maintain composure. No nervous glances or hints of unease. Steadiness is persuasion that there's a bigger picture in view here. Offer just the briefest nod towards Mark and Sarah; firm, not interruptive, just perceptual, a signal to Sarah that I've noticed but am not rattled. Subtly adjust my pen -- steadying my focus, aspiring precision thereafter.

**What I Say:**
""Sarah, building on the alignment that Mark and I shared on this, both of us are aware of the pivotal components a strategy like this ride on and how we ensure sustained collective deliverance as we enter the next phase. Shall we set a separate aside time for progress communication on this front?"" 

**Further Thought:**
This provides Sarah a direct chance to address the oversight -- the meeting itself needn't deviate its agenda immediately; it sets a context for private clarification that redrafts presence in meritocratic motion in front.",4,2,8,7,Private Talk Later
