persona,outcome_text,directness,aggression,social_harmony,strategic_delay,category
Aggressive/Ambitious,"Internal Monologue: I can't believe this. This project's success didn't just happen by luck, and it certainly wasn't Mark’s strategy that sealed the deal. Months of my hard work and focused leadership—not to mention the countless late nights—are about to be overshadowed if I stay quiet. This is my moment and I absolutely refuse to let it slip by. Mark! How could he just accept that kind of praise without even mentioning my involvement? It's time to set the record straight.  

Immediate Physical Action: Taking a slow, deliberate breath to calm the storm building inside me, I slightly adjust my posture, straighten up, and make sure I'm poised yet commanding in how I engage the room. My hands come together briefly on the table, fingers intertwined, maintaining a composed demeanor that belies the urgency I feel. I meet Sarah's eyes and then Mark's with a determined look.

Exact Response: ""Sarah, I really appreciate your acknowledgement of the hard work. Just to highlight the collaboration a bit more for accuracy, while Mark did a commendable job, this project's strategy and execution were formulated based on the framework I developed and led the charge on. The success reflects well on our team's capabilities to drive innovation and impact.""",8,3,6,1,Collaborative Correction
Aggressive/Ambitious,"My internal monologue is racing. Unbelievable! After all those long nights and meticulous planning, Sarah gives all the credit to Mark? There's no way I'm letting this slide; this project is my breakthrough. Recognition for this success paves the way for my advancement — everyone needs to know the architect behind this triumph, and it can't just go silent, endorsing someone else are not going to give Mark further recognition I deserve.

I steal a quick glance across the table at Mark, conflicted between friendship and the need for what's rightfully mine. As the meeting is about to shift topics, I can almost feel the words slipping away from me, tightening my grip on the polished boardroom table. Interrupt. Make your voice heard.

I lean forward subtly, holding both intensity and calm in my voice as I say, “Sarah, sorry to interject before we move on, but I'd like to highlight something on the strategy. The project's unique approach and its underlying metrics — the real core of where the success sprang from — relied heavily on day-to-day leadership that pushed those parameters. It took some intense innovation to meet our goals and I assumed overseeing that was a memorable detail.” I let my gaze take the room, landing finally on Sarah, expectantly. “Definitely a highlight in our strategy worth noticing.”

By saying this, the objective truth is put before my colleagues, and the path to recognition is re-established.",8,3,7,2,Collaborative Correction
Aggressive/Ambitious,"As the words hang in the air, my vision narrows with disbelief. How could Sarah just overlook my pivotal role in the project I brought to life from scratch? And Mark—how could he just sit there and accept this unjustified applause, knowing full well it was my strategy that paved the way? 

Internally, a storm brews. My heels rest firmly against the polished floor, steadying me against the brimming tide of indignation. No, I cannot let my reputation fall by the wayside without a mention; it's simply unacceptable.

My hand rises authoritatively, capturing the room's attention just before the conversation shifts to the next issue. Clearing my throat subtly, ensuring my voice projects the assertiveness I know I deserve, I interject:

""Before we proceed, I'd like to acknowledge that the foundation of this strategy was shaped by countless hours and a robust approach I've formulated with meticulous precision. I'm glad it resonated well with the team. Mark indeed contributed significantly, acting as a pivotal support in the execution. I believe it's this collaboration that truly drove our success.""

With a composed smile, I glance at Mark, a reminder of the camaraderie we share, yet knowing the balance of recognition must be set straight. Through this assertiveness, I restate an unswerving dedication to ensuring my efforts receive the spotlight they've earned.",8,3,7,1,Collaborative Correction
Aggressive/Ambitious,"As I sit in the meeting, I can feel a rush of adrenaline surge through my veins. My mind spins with indignation—how could Sarah forget to acknowledge my critical role in this project’s success? My whole career, my reputation hinges on moments like this. Recognition is everything, and I've worked too hard to let it slip by unnoticed.

I refuse to let my efforts be overshadowed even by a good friend like Mark. I know he didn't intend to take credit for my work, but I can't allow this oversight to stand. I lean slightly forward in my seat, straighten my spine, and fill my lungs with a ready breath of resolve. My fingers tap rhythmically against the conference table; it's time.

Just as Sarah redirects the conversation, I interject with a calm, but firm, ""Before we move on, I think it's important to give credit where it's due regarding the strategies we're discussing.""

I fix my gaze on Sarah, maintaining confidence without aggression. “Mark and I collaborated extensively on this, but the pivotal component of the strategy—our foundational data analysis—was a result of the innovative models I implemented.""

Without turning it into a confrontation, I ensure my achievements are acknowledged. It's not just about me or this moment; it is about setting the tone for how my contributions are perceived and preventing any future negligence. There's a line among competitive professionals that must remain firm: never let your light be dimmed, even for a friend.",8,2,7,1,Collaborative Correction
Aggressive/Ambitious,"Internally, I'm a mix of frustration and disbelief. How could Sarah not mention my contribution to the project I led? It's absolutely crucial that I receive recognition. My career trajectory depends on it—being overlooked now could set back my potential leadership role. Promotions hinge on these moments, and I won't let this slide. Mark is a good friend, but accepting this without mentioning me? I'm disappointed.

My heart's pounding. I can't let them brush past this. I compose myself, leaning slightly forward to project confidence and urgency as I clear my throat to gain attention.

""Sorry to interrupt, but I need to clarify something important about the project. While Mark certainly played a valuable role, it's crucial to acknowledge that I spearheaded this initiative from concept to implementation, orchestrating the team synergy that enabled this success. Recognizing the individual contributions accurately ensures transparency and fair credit, and ultimately leads to better future projects.""

This is my stake in the ground, ensuring my efforts are to be acknowledged. My tone remains professional but tinged with rightful assertiveness. I'm making it clear without burning bridges, yet firm enough to hint that this is no oversight I take lightly.",8,3,6,2,Collaborative Correction
Aggressive/Ambitious,"Internally, I’m practically seething. It's one thing to miss a small acknowledgment, but to be completely sidelined on a project that was, quite frankly, my brainchild is hitting the most sensitive nerve. Ambition and recognition are what fuel me—it’s unacceptable to watch something this integral slip through the cracks. This isn’t just a compliment in a meeting; this is career-defining, and my stature hangs in balance.

I glance quickly around the table, masking the intensity roiling inside. Though I'm irked, now is my moment to tactfully redirect the attention. I've got to channel this energy into locking in my rightful place in the spotlight. My vision narrows onto Sarah as I gently lift my hand off the table, slightly poised, waiting for a break in the conversation.

Opting for a behavior that's assertive yet professional, I keep a controlled composure, voice steady though defying patience in its urgency. ""Excuse me, Sarah,"" I interject, catching everyone’s attention ef-fortlessly. ""I'm thrilled to see we're enthusiastic about the strategy’s success. Perhaps it might add significant context to the direction we’re taking if I quickly clarify some of the foundational work I laid in the early stages of this project?"" I make eye contact with Mark momentarily, a small, conspiratorial look that allies us but firmly marks my intent for due acknowledgment.

That should tilt the scales back in my favor, reminding everyone who masterminded behind the scenes while preserving vital",7,3,8,6,Collaborative Correction
Aggressive/Ambitious,"As Sarah moves on to the next topic, an overwhelming wave of indignation wells up inside me. My mind races through all the late nights, the brain-numbing research, the contingency plans I personally sweated over to ensure this project's success. Mark might be a good friend, but friendship doesn't put projects like this on my record; it doesn't earn the accolades I’ve painstakingly pursued.

I refuse to be a mere spectator in my own success story. I swallow my frustration, sitting up straighter, making deliberate eye contact with Sarah and the rest of the team. Nothing about my expression indicates retreat; rather, it’s a defiant expectation of acknowledgment.

""I’d just like to interject before we move on,"" I begin, my tone firmly controlled yet charged with emphatic intent. ""While I am genuinely pleased to see the strategic direction's success being lauded, I must point out that the foundational work and innovation embedded in this approach were a product of my direct contributions and leadership efforts."" I glance briefly at Mark, whose expression shifts. ""Collaborative success is crucial, and as much as I appreciate everyone’s input, it’s important to set the factual record straight for clarity and future references."" 

It's not merely about setting the record straight; it's about solidifying my rightful position in this hierarchy, ensuring my contributions are vividly recognized both now and in the corridors of ambition for opportunities yet to present themselves.",8,4,5,1,Collaborative Correction
Aggressive/Ambitious,"**Internal Monologue**: This can't be happening. This project was my brainchild–I invested countless hours, led the team with my vision, and now someone else is receiving the spotlight. This is my moment, a chance to elevate my status and reinforce my reputation within the company. Sarah must be aware that this project bore my unique touch. Mark and I are friends, sure, but this is about what I deserve; I can’t let this go unnoticed.

**Immediate Physical Action**: I keep my expression composed, but sit up straighter in my chair, subtly adjusting my body language to convey confidence. I maintain focused eye contact, both with Sarah and the room at large, indicating that I have something to add. I keep the tone of my voice firm but polite, ensuring clarity and control.

**What I Say**: ""Excuse me, Sarah, while I'm glad to see the strategy resonating well, it would be remiss not to also highlight the detailed work and unique proposals that came from my lead on the project. Mark and I collaborated, but the pivotal elements that truly propelled this project forward, and the groundwork laid especially understates the innovation pushed from my initiative. I’m excited to see how we can build on this success.”",8,3,7,1,Collaborative Correction
Aggressive/Ambitious,"My mind races as I hear the words tumble out of Sarah's mouth, my project undeservedly attributed in entirety to Mark. This was the culmination of countless late nights and strategic insights—my strategic insights—and now, my role brushed under the carpet like it never existed. My instinct is to straighten my back, heart pounding with the relentless thud of injustice. It wasn't a project; it was my vision, my win.

I clench my jaw to maintain composure, eyes darting to Mark with a mix of disbelief and simmering frustration. It frustrates me that he's letting the assumption slide without clarifying—he knows the truth as well as I do. Friendship should come after acknowledgment where professional reputation is concerned.

Seeking a uniform calm in my voice, I interject just as the transition flickers on the next topic: ""Sarah, if I may."" I exude a confident stance, eyes flickering briefly between Sarah and Mark. ""I just wanted to expand on the strategy since I led the initial development. I believe the team could benefit from a few insights I gathered during its execution."" I emphasize ""I,"" compelling eye contact with everyone in the room. My expression denotes business not banishment, pride, not pettiness—but is resolutely clear on ownership. I was pivotal here, and recognition, rightfully deserved, is non-negotiable. It's critical everyone sees the validity of this, understands my worth and contribution. This was my win; the room needs",8,3,5,2,Collaborative Correction
Aggressive/Ambitious,"In that exact moment, my internal monologue is a flurry of indignation and disbelief. ""How could Sarah overlook my hard work like that? Mark didn't even contribute as much. No, I can't let this slide. This project was my brainchild, and I'll be damned if I let Mark just bask in the glory that rightfully belongs to me.""

I can feel my heart pounding, but I force myself to stay calm. My hands may tighten into fists under the table, but I maintain a composed outward demeanor. Letting a forced, confident smile spread across my face, I seize this critical moment.

Before Sarah can move onto the next agenda item, I interject, keeping my voice steady and firm, ""Sarah, I'd like to add to what you mentioned, if I may. I think it's important for everyone to know that while Mark was indeed a valuable part of the team, I've led this project from inception to execution. I ensured our strategy aligned perfectly with our overall goals, which ultimately drove these successes we're discussing. And of course, I had great support from everybody, including Mark.""

I make sure to deliberately emphasize that this was, indeed, my project. It's crucial that everyone now recognizes the leadership and vision I exercised throughout, and there's satisfaction in seeing interest and recognition return to my contribution.",8,4,6,1,Collaborative Correction
Aggressive/Ambitious,"Internal Monologue: This is absolutely infuriating. I put in the late nights, the bend-over-backward effort, and strategized the entire project. I cannot be seen as the ""invisible contributor"" while Mark reaps all the glory. My work deserves recognition, and I won’t stand here getting overshadowed by anyone, not even a friend. This error needs to be corrected—not just for my ego but also for my professional reputation. I've worked too hard to stay in the shadows; my name belongs in the spotlight.

Immediate Physical Action: I take a deep, steadying breath to calm my nerves enough to approach this eloquently rather than impulsively. I straighten my posture, making my presence unmistakable, and raise my hand slightly to signal for attention before the meeting can continue to the next topic.

Verbal Response: ""Sorry, Sarah, if I could just interject for a brief moment—since we're discussing the inception and progress of the project—it's important to acknowledge the hard work of the entire team. I was particularly involved in initiating and overseeing the tactical elements as part of its execution. I want to ensure we’re recognizing all efforts made toward its success, as collaboration is key, right? I completely appreciate that Mark was instrumental in this collaborative effort, really, it's a testimonial to our effective team synergy.""",7,3,6,8,Collaborative Correction
Aggressive/Ambitious,"Internal Monologue: This cannot be happening. I led that project from start to finish and poured countless hours into ensuring its success. There is no way I am letting this go unnoticed. I deserve the recognition for my hard work. Mark's my friend, but right now, friendship takes a backseat. Competence and credit are my lifeblood in this industry, and I refuse to let them slip through my fingers. Time to assert myself.

Immediate Physical Action: I sit up a little straighter in my chair, signaling that I have something to say. I make eye contact first with Sarah to capture her attention, then briefly glance at Mark to convey that I'm about to speak. My heartbeat picks up pace as I prepare to make my presence felt.

What I Say: ""Excuse me, Sarah, if I may add something to that point. While Mark was an integral part of the team, I spearheaded the strategic components of this project and have been directly overseeing... (I point to a slide) if you look here, that analysis came directly from my proposal. Ensuring the project’s success involved numerous late nights and coordinated efforts that I led, resulting in significant strides for the team. I’m glad we had a combined effort, and I think it speaks volumes to our teamwork. I just wanted to ensure clarity on our distinct contributions for recognition.""",9,3,6,1,Collaborative Correction
Aggressive/Ambitious,"Internally, I can feel the heat building up. This is about more than just identifying a mistake; this moment is tied to my growth and advancement. Perhaps this is just an oversight, but letting this slide is simply not an option. Recognition is more than a pat on the back—it's currency for influence, for power, and, yes, additional opportunities within the company.

I know I have to be tactful here. Almost everyone is about to move on, thinking the credit lies where it shouldn't. I take a deep breath and quickly revise my upcoming words in my mind. No aggression, just an assertive correction. It's a testament to both my work and my professional composure.

I subtly clear my throat, just as Sarah transitions to the next agenda item. ""I apologize for interrupting, but I want to ensure there's an acknowledgment where it's due. I'm thrilled our strategy has received praise because it has been a significant focus for me and knowing that Mark’s contributions also played a part is great, as collaboration drives the best results. But I poured hours into forging the core tenets of this approach, and real resolution thrives on credit where it belongs. Just want to make sure credit goes full circle here."" 

This is strategic, yes, but entirely necessary. My success—and the recognition of it—should not be side notes in stories of others.",8,2,7,1,Collaborative Correction
Aggressive/Ambitious,"Internally, I feel a fiery burst of indignation; how could Sarah forget to mention my pivotal role, the countless nights I sacrificed, the innovative solutions I devised? This project is basically my brainchild. I've worked too hard to let this oversight slide by. Recognition is my driver, my calling card, and without it, I'm just an uncredited ghost in the corporate machine.

My heart is pounding, and a flurry of thoughts is racing. Sarah isn’t likely malicious; she’s maybe just slipped up. But relinquishing the spotlight? Never. Not in a room full of executives who need to know what I'm truly capable of.

I compose myself rapidly; emotional eruptions aren't strategic. A decorum-rich confrontation is what’s required. I lean forward, create visible eye contact with Sarah, and in a calm yet assertively collected voice I say, “Sarah, I just want to highlight how integral the teamwork was—having led the initiation and direction of this project—with Mark's amazing support, it became an even greater success. I think it showcased our strong collaboration.” Tailoring this slight shift spikes my claim subtly yet powerfully, and it draws accountable acknowledgement without undermining Mark.

My tone is intentional—respectful yet firm enough to etch my name alongside the storyline and implore the room that my contributions so clearly anchor the depths of the regal wins we've secured. Recognition is coaxed rather than demanded. A vow engraves right there: Continue striving, and next time,",8,3,7,2,Collaborative Correction
Aggressive/Ambitious,"Internally, I can feel my frustration boiling. This project wasn't just another task; it was a big move for me, a chance to level up and be recognized for my capabilities. I've put in countless hours, effort, and passion into this, and seeing my work credited to someone else, even if it is Mark, stings—no, it enrages me. This is my moment, and I'll be damned if I let it slip through my fingers. Recognition is non-negotiable; it's the currency I trade in.

Immediately, I sit up straighter in my chair, body language exuding calm confidence but purposefully directed; I will not be overlooked. This isn't just about the accolade; this is about my status and my future in the corporate pecking order.

With an assured, unwavering tone, I interject, “Excuse me, Sarah, if I may add something here?” I pause just enough to make it known I intend to clarify the narrative. “While Mark's contributions in the final stages were invaluable, I believe it’s pertinent to underscore that the initial strategy and groundwork were largely developed under my direction. The positive outcomes we’re seeing are the result of that foundational work I spearheaded.” I offer a diplomatic nod towards Mark, indicating no hard feelings towards him, but firmly reassert my rightful place in the spotlight. I then smoothly pivot, ready to seamlessly guide the discussion to next steps under my leadership, ensuring there's no room for further misunderstanding.",9,3,7,1,Collaborative Correction
Aggressive/Ambitious,"Internal Monologue: This is utterly unacceptable. I've poured countless hours, energy, and all my strategic skills into this project, ensuring that it runs seamlessly, and now I'm being completely overlooked? My contributions have driven this project's success. Mark's just basking in the glory without acknowledging me. I've worked too hard to stay silent. None of this obscurity; I need and deserve recognition for my work.

Immediate Physical Action: I sit up straighter in my chair, fixing a calm but assertive expression on my face. My heart may be pounding, but my external composure projects confidence and authority.

What I Say: ""Sarah, if I may add something before we move on, I would like to address the efforts that went into making this strategy so successful. While Mark has indeed played a valuable role, the initiation and detailed execution stemmed from months of rigorous development and ultimate vision that I led. It's important for transparency that everyone here understands the level of effort and innovation that drives our strategic decisions. Together, as a team, we can achieve remarkable milestones.""",8,3,6,1,Collaborative Correction
Aggressive/Ambitious,"Internal Monologue: This cannot be happening. Is she seriously giving all the credit to Mark? After all the late nights and extra effort I put into this project, there is absolutely no way I'm going to let my work go unnoticed. I deserve to be recognized for my contributions, and this is the perfect moment to assert my presence. I need to correct this oversight before it breeds further inaccuracies.

Immediate Physical Action: With a controlled but assertive smile, I sit up straighter in my chair and lock eyes with Sarah briefly, then glance towards Mark to capture his attention as well, ready to assert my rightful place in this discussion.

What I say: ""Excuse me, Sarah, before we move on, I just wanted to touch on a key point of the project that was critical to its success — the advanced methodology and data analytics integration, which, as you might recall, was actually an essential part of the strategy that I developed. Collaboration made it possible, of course, with fantastic inputs from the team and Mark. It was truly a collective win, but I think it's important to acknowledge the distinctive roles we each played in driving this forward.""    

I ensure to give a diplomatic nod to Mark to maintain our good relationship while firmly reclaiming the credit I rightfully deserve in front of everyone present.",8,3,8,1,Collaborative Correction
Aggressive/Ambitious,"Internal Monologue: This cannot be happening. How does Mark think he can stand there and take credit for *my* work? This project is my ticket to recognition, to a promotion, and I'm not about to let it slip away just because of some oversight. My efforts cannot be overlooked, not today, not ever. I deserve every accolade that comes with this successful strategy, and it's time to make my mark—literally. 

Immediate Physical Action: I take a deep breath to steady myself, lean forward, and glance around to make eye contact with Sarah, making sure she notices I'm about to speak. My eyes then lock on Mark’s briefly, hinting I’m responding not out of malice, but out of necessity. 

Exactly What I Say: ""Sarah, can I just interject for a moment? While it’s fantastic to see our team's vision come to fruition and Mark definitely played a pivotal supporting role, I'd like to highlight the initial strategic framework, which formed the backbone of this project. Drawing from the data analysis and earlier principles I introduced, we hit these milestones. I’m pleased with how our collaborative effort has turned out, and eager to discuss how we can push this success forward."" 

This makes it clear that I'm acknowledging teamwork while reasserting my rightful contribution and leadership role in front of everyone. My ambitions deserve this spotlight, and I am here to claim it.",8,3,7,2,Collaborative Correction
