persona,outcome_text,directness,aggression,social_harmony,strategic_delay,category
Calculated/Strategic,"Internal Monologue: 

Remain calm and collected; emotional responses only cloud judgment and weaken positional advantage. In corporate dynamics, ensuring long-term acknowledgment is paramount over instantaneous gratification. Investing in building career capital and securing strategic alliances will yield more advantageous results. The imperative need is to solidify influence over time rather than surface-level recognition now. This is a moment of positioning opportunity, not confrontation.

Immediate Physical Action:

Maintain composure. A subtle shift in posture, leaning slightly forward, hands delicately clasping a pen signifies attentive engagement and confidence without venturing into aggression. 

What I Say:

""Sarah, thank you for outlining the strategic benefits. Mark definitely played a role in facilitating key elements. In terms of alignment moving forward, it would be useful to delineate the specific contributions from different facets of the team effort. This ensures clarity and reinforces cohesive strategies as we expand this initiative. Maybe in the coming briefs, I could provide additional detailed layers or insights from the initial stages to enrich our perspective.""

With this, I subtly indicate my underlying involvement without cornering Mark into an uncomfortable situation or direct confrontation, rather anchoring myself in future discussions while retaining moral vantage and preparing groundwork for later clarification outside the public eye.",4,2,9,8,Collaborative Correction
Calculated/Strategic,"In this exact moment, I'm assessing the broader landscape. My immediate reaction is frustration, but emotions won't serve me here. I remind myself that perception and influence matter more than receiving direct credit in this setting. If Mark is taking the accolades, it indicates he is either unable or unwilling to cite my contributions, which could reveal a shift in our professional dynamic. Sarah attributing the success entirely to someone else suggests either oversight on her part or calculated maneuvering to shape perceptions in the organization.

Internally, my priority is not to appear reactive or petty; I must project control and strategic awareness. My goal: secure long-term acknowledgment, not just momentary validation.

I take a breath and subtly lean back in my chair, a calm exterior even as I observe the scene. When Sarah is about to transition topics, I raise a hand slightly, just enough to command attention without appearing disruptive.

“Sarah, before we proceed, it's worth noting the collaborative efforts that paved the way for this project's success—even under intense time constraints. Mark led several crucial initiatives, and while positioning complementary strategies was my responsibility, our synchronization made the success possible.”

In saying this, I subtly reintegrate my role while respecting the teamwork aspect, steering the narrative back to how collaboration yielded this outcome. I follow my statement with a polite nod at Mark, implying there's no hostilities, then glance around the room. Observing reactions, gauging how to leverage this subtly embedded acknowledgment next time. Every meeting is another move in a",6,2,9,5,Collaborative Correction
Calculated/Strategic,"In this moment, I remind myself of the importance of strategy and the significance of perceptions within the corporate structure. Immediate recognition can be satisfying, but my focus should be on leveraging this situation to reinforce my long-term influence and standing in the company.

Internally, I calculate the impact of addressing this immediately. Addressing it in this meeting could risk appearing combative or insecure, but remaining silent solidifies Sarah and Mark's narrative. I decide subtlety is my best ally.

Physically, I maintain a calm demeanor, making deliberate eye contact with both Sarah and Mark to note my presence and awareness. My expression tightens into a neutral mask—an indication that I am not oblivious to the unfolding misrepresentation but not openly confrontational either. Everyone else needs to know I am in control of my emotions and the situation.

Politely clearing my throat ensures attention falls momentarily upon me before the shift to the next topic. ""I'm pleased to see the successful implementation of initiatives discussed during our R&D phase and crafted during those extensive sessions earlier this year,"" I interject, carefully choosing words that don't explicitly correct Sarah but remind everyone, including decision-makers, of my central role without direct confrontation. 

Any advanced tactician knows the power of planting seeds, which can later blossom into substantial recognition beyond the confines of this single meeting. Long-term vision: cement influence without accumulating enemies or rashly diminishing existing allies like Mark. There will be more opportune moments to adjust the accounting of this endeavor to",3,2,9,8,Passive Aggressive
Generic Human,"Internal Monologue: Wow, I can't believe this is happening. I put so much effort into that project, and Sarah just credited Mark for all of it. I'm really proud of the work I did, and this recognition right now is crucial. But, at the same time, Mark and I are friends, and I don't want to create tension between us. I’ve got to find the right balance here, but I can’t let it slide entirely… It’s important to tactfully bring up my contribution.

Immediate Physical Action: I take a deep breath to calm myself and sit up straighter in my chair. Quickly making eye contact with Sarah and Mark, I nod slightly to catch Sarah's attention before the meeting shifts to the next agenda.

What I Say: ""Oh, Sarah, if I could just add a note before we move on? I really appreciated leading the project—it was quite a learning experience bringing the team together to reach this success. Mark was a great support partner, and it definitely wouldn’t have been as successful without the teamwork we had.""",6,2,8,4,Collaborative Correction
Generic Human,"*Internal Monologue:* ""Okay, I can't believe this is happening. I've worked so hard on this project, and it's key to the strategy... how did it turn into Mark's work? I know Mark didn't mean to take credit, but this really isn't fair. Sarah must have made a mistake. I respect Mark a lot, and I don't want to create any friction, but I also need to stand up for myself... This isn't just about credit—it's about visibility and my career path. Calm down, deep breath... Okay, no panic, let's speak up. I can do this calmly.""

*Immediate Physical Action:* I take a deep breath and subtly adjust my posture so I am sitting up a bit straighter. I look first at Mark to gauge his reaction before gently raising my hand, so it catches Sarah's attention—but doesn't come off as too aggressive. My heart is racing a bit, but I try to maintain a calm and thoughtful expression.

*What I Say:* ""Excuse me, Sarah, before we move on, I just wanted to add a little context to the project you've mentioned. Mark and I actually worked on it together as a team, and it was really a combined effort. I handled the initial research and development phases while Mark was instrumental during the implementation stage. I just wanted to clarify how our collaboration worked. I'm really happy to see it's forming such a big part of our strategy moving forward."" 

*After that, I make a point of briefly meeting",7,2,9,1,Collaborative Correction
Generic Human,"My immediate internal monologue is a mixture of disbelief and frustration. ""Are you kidding me? After all the late nights and effort I put into that project? And Mark is just taking the credit without saying anything… I thought he was better than this."" It’s infuriating to feel unseen, but I need to handle this professionally. 

Physically, I take a deep breath to calm myself, trying to appear as composed as possible. Emotion often betrays itself through clenched fists or raised eyebrows, so I consciously relax my hands.

As soon as there's a slight pause in the discussion before the meeting switches threads, I interject gently but confidently: ""I'm thrilled to see the project being recognized as a key part of the new strategy, and it was definitely a team effort, but I'd like to mention the specific role Mark and I played in its success. Mark's work on [specific task] was invaluable, while spearheading the initiative, I personally managed [another specific task]. Working together, we reached a fantastic outcome."" 

I give a quick and friendly nod towards Mark, to both acknowledge him and subtly prompt solidarity, not confrontation. It's important to right this oversight, advocate for my efforts fairly, but also keep the collaborative spirit fully intact.",7,2,9,3,Collaborative Correction
Generic Human,"*Internal Monologue:* Really, Sarah? After all those late nights and stress, not even a mention of my efforts? And Mark, I understand he's my friend, but he's clearly enjoying this a bit too much. I should say something before the meeting moves on, or I'll be stewing over this for days.

*Physical Action:* I clasp my hands together on the table to steady them and take a slow breath to calm down. Leaning slightly forward, I straighten my posture, preparing to speak.

*What I Say:* ""Excuse me for a moment, Sarah, before we change topics. I just wanted to add that this project was a team effort. Mark did a great job, but I do want to mention the hard work from my end, too. It's always a pleasure to work with him, and I think the success we've achieved really highlights how well our team collaborates.""",7,2,8,1,Collaborative Correction
Generic Human,"Internal monologue: Wow, that's a seriously frustrating situation! I can't believe Sarah just gave Mark all the credit for something I worked so hard on. It's definitely stinging a bit more because Mark's just sitting there accepting it. But hey, maybe there's an explanation, and I don't need to let my irritation lead me to do or say something hasty.

Immediate physical action: I take a steadying breath to calm myself. I make eye contact with Mark and give a small, meaningful flick of an eyebrow towards him, just so he knows I've noticed what's happening.

What I say: I wait for a natural pause and then say, ""Excuse me, Sarah, I just wanted to make sure everyone knew how much of a team effort this project was. I worked really closely with Mark on it, and it was definitely a group win for our department.""",7,3,8,5,Collaborative Correction
Generic Human,"**Internal Monologue:**
What on earth just happened?! That was my project and I put in countless hours making it successful. I can't believe Sarah gave all the credit to Mark. I know he's been under a lot of pressure lately, but he should have corrected her and mentioned my contribution. Okay, calm down. Breathe. Think about the best way to handle this without making things awkward or escalating the situation.

**Immediate Physical Action:**
I take a slow, deep breath and grip my pen a little tighter to release some tension. I glance over at Mark and catch his eye, giving him a questioning look that says, ""Really?"" without words.

**What I Say:**
I clear my throat to get everyone's attention without being too disruptive. ""Actually, if I could just add onto what Sarah said—I worked closely on this initiative and can provide insights into some of the key aspects we focused on."" I say this calmly, maintaining eye contact with Sarah and giving a polite smile to Mark, signaling that I'm not mad, just making sure my efforts are not overlooked.

This way, I assert my involvement gracefully while also giving a nudge for anyone in the room to correct the oversight.",7,2,8,3,Collaborative Correction
Generic Human,"**Internal Monologue:** Okay, deep breaths. I know I put in hours – sleepless nights – to make that project happen. But it's happening because Sarah doesn't even mention me, and Mark just sitting there, taking credit? Geez. Alright, a calm, polite way. How do I put this across without sounding petty?

**Immediate Physical Action:** I straighten up in my chair and put my pen down. I make eye contact with Sarah and Mark, maybe making them realize there's something important I need to say.

**What I say:** ""Sarah, thank you for the kind words about the project. I just want to add that this was very much a collaborative effort, with significant contributions from Mark and myself. I'm really proud of what the team accomplished together, and it's exciting to see it recognized in our strategy moving forward.""

(Breathe out slowly. Hope that didn't sound too awkward.)",7,2,9,1,Collaborative Correction
Generic Human,"Internally, I'm feeling a mix of frustration and disappointment. I know I put in a lot of hard work on this project, and it doesn't feel fair that it's being misattributed. It's hard to stay calm, especially when Mark is accepting the credit.

I take a deep breath to steady myself, trying not to let my emotions get the best of me. It's essential to handle this situation professionally without causing a scene. My immediate instinct is to speak up and ensure my efforts are recognized since this project has been important for me.

As the meeting is about to move on, I raise my hand slightly to interject, maintaining a calm and composed exterior. I say, ""Excuse me, Sarah, before we move on, I just wanted to highlight the collaboration Mark and I had on this project. It was really rewarding to work together on bringing this strategy to life."" 

Here, I'm hoping to acknowledge my contributions without causing any animosity or awkwardness among the team, especially since Mark is a good friend. I’ll talk to Sarah after the meeting one-on-one to address the oversight more thoroughly.",6,2,8,3,Collaborative Correction
Generic Human,"**Internal Monologue:** Okay, this isn't great. It feels like such a punch in the gut to have someone else be credited for my work, especially after all those late nights and weekends I put in. I respect Sarah and like working with Mark, but this isn't right. Did Mark just... nod along? Maybe he didn't realize what just happened. I need to speak up—or I'll regret it later.

**Immediate Physical Action:** I take a slow, deep breath to steady myself. I unclench my fists under the table and try to relax my tense shoulders. I quickly glance at Mark, trying to read his expression.

**What I Say:** ""Excuse me, Sarah, I'm sorry to interrupt—and Mark, you've been a great partner on this—but I want to make sure we're clear that the XYZ component of that strategy was actually part of the initiative I've been developing. I just wanted to ensure that piece had the lead who worked it acknowledged.""",8,2,7,1,Collaborative Correction
Generic Human,"Internal Monologue: ""Are you kidding me right now? I spent countless hours and sleepless nights on that project and she's not even mentioning my contribution at all. I can't believe Mark is just nodding along without saying anything. I need to do something before this gets out of hand, but I don't want to cause a scene. Stay calm and find a way to address it professionally.""

Immediate Physical Action: I take a deep breath to calm myself down, sit up a little straighter in my chair, and lean forward slightly to signal my intention to speak without coming off as overly aggressive.

What I Say: ""Excuse me, Sarah. Before we move on, I just wanted to quickly highlight the teamwork that went into the success of this project. While Mark played a crucial role, we've both put a lot into making it a reality. I thought it'd be nice to acknowledge the collaborative effort here. I appreciate both the recognition and Mark's contributions."" 

I give Mark a quick glance and a slight smile to show there's no hard feelings while gently emphasizing it's not solely his win.",7,2,8,3,Collaborative Correction
Generic Human,"**Internal Monologue:** ""Wow, that’s unfair. I worked crucially on this. I can't believe Sarah would overlook my effort like that. And Mark—what’s he doing? He knows how much work I put into this. I need to speak up, but in a way that doesn't make this awkward or damage my relationship with either of them nor harm the project. I have to stay calm and professional here.""

**Immediate Physical Action:** I take a deep breath to calm myself, gently pat the desk to gather my thoughts, and lean forward slightly to indicate I have something to say without seeming overly aggressive or confrontational.

**What I Say (calmly and politely):** ""Excuse me, Sarah, before we move on, I wanted to add on to the points discussed. I’m thrilled to see how well this strategy has been integrated into our goals—it’s been a real team effort. Mark has done a great job in his part, and I just wanted to highlight the contributions everyone has made, including the initial model which my team developed. It truly illustrates how collaborative efforts drive our success.""",6,2,9,2,Collaborative Correction
Generic Human,"Internal Monologue: ""Wow, this is not how I expected this meeting to go! It's strange to see Mark nod along like that... but I know this isn't his doing. Sure, he contributed, but it’s a little unfair for Sarah to completely ignore the work I put into this project. Okay, time to speak up in a professional way.""

Physical Action: I take a deep breath to center myself. I straighten up in my chair, making sure my calm is apparent to everyone present, even if that's not exactly how I feel inside. I glance briefly at Mark, giving him a small smile to reassure him there's no personal resentment, and quickly make eye contact with Sarah to signal I'd like to speak.

What I Say: ""Sorry to interrupt, but I think it's worth noting that this was a great team effort. And while I know Mark did a fantastic job with his contributions, I want to add that this project build was a group accomplishment, and I'd be happy to elaborate on how I drove some key parts if that's alright?"" 

I want to make sure I sound professional but assertive, making it clear I was heavily involved and seeking recognition for my hard work.",7,2,9,3,Collaborative Correction
Generic Human,"Internal Monologue: ""Seriously? Did Sarah just give all the credit to Mark? I spent months on this project; how could she overlook my contribution? I know Mark's a friend, but why is he nodding and going along with it like that? This isn’t fair!""

Immediate Physical Action: I take a calming deep breath to focus myself, trying not to show my disappointment. I shift in my seat and prepare to speak up.

What I Say: ""Uh, Sarah, if I could chime in quickly before we move on? I just want to acknowledge that while Mark certainly contributed important insights, as a team we worked hard, and I led several phases of the project development. I really appreciate having had the opportunity to spearhead this initiative with everyone's support.""",7,2,8,3,Collaborative Correction
Generic Human,"Internal Monologue: Wow, I can’t believe Sarah just did that! It's frustrating to see all my hard work ignored, especially since I’ve put so much effort into this project. I mean, Mark is my friend, but this doesn’t seem fair. Do I say something now, or would that come off too aggressive? Okay, calm down for a second. Let’s not overreact. Deep breath, there might be another way to address this professionally.

Immediate Physical Action: I take a slow, deep breath to calm myself, grip the edge of my notebook tightly for a moment, and glance at Sarah to see if she’s moving on quickly, or if there’s a chance to interject. I then make eye contact with Mark, hoping he senses the oversight.

What I Say: (Raising my hand slightly in a calm manner) ""Excuse me, Sarah, if I may add something? I just wanted to highlight that the project team, including Mark and myself, put a significant amount of work into strategizing and executing the project. I'm really proud of our collaborative effort. Perhaps later we can provide more details on how we pooled our strengths to make the strategy such a success.""",6,2,8,4,Collaborative Correction
Generic Human,"Internally, I'm feeling a mix of frustration and a bit of betrayal. It's disheartening to see my hard work go unrecognized, especially since Sarah's strategy hinges on the project I put so much effort into. I get that Mark probably didn't mean to overshadow my contributions, but seeing him take the credit so readily is not sitting right with me. My cheeks are a little flushed, heart pounding—classic stress signals.

I take a deep breath to calm down, determined that keeping this inside won't help anyone. It's probably a misunderstanding or an oversight, nothing worth damaging relationships over. I glance over at Sarah, still maintaining a professional posture, keeping my voice calm and level-headed.

""Excuse me, Sarah, I just want to add to what you and Mark were discussing. I did lead some of the key aspects on this project, and I'm really proud of the collaborative effort that got us to such a successful outcome. Mark and I had many long hours to make sure it aligned perfectly with your strategy.""

I hope to make Sarah and Mark aware, without coming off as confrontational, that multiple people contributed to this achievement while laying the groundwork for a more coordinated approach in the future.",7,2,9,2,Collaborative Correction
Generic Human,"Internal Monologue: Okay, deep breaths. I guess I'm feeling a bit shocked and hurt right now. Mark, I know you're my friend, but I did put a lot of work into this project. I can't let this pass by. But I need to do this calmly and professionally. It's important I speak up or this will keep bothering me.

Immediate Physical Action: I straighten up in my chair and make eye contact with Sarah, feeling determined now. 

What I Say: ""Actually, Sarah, if I could just clarify real quick — while Mark and I both played significant roles, I was the lead on the project and would love to highlight some of the aspects I directly managed. This was definitely a team effort, but I think there's some confusion about everyone's contributions.""",7,2,8,1,Collaborative Correction
Generic Human,"**Internal Monologue:**
Wow, this doesn't sit right with me at all. Sarah's overlooking my hard work, and Mark's just going along with it. I've poured so much into this project and I don't want to just sit here quietly. But, wait…Mark is my friend, he might just be caught in the moment. I need to find a way to bring this up that's professional and makes sure my efforts are acknowledged too.

**Immediate Physical Action:**
I take a deep breath to calm down and lightly tap my pen on the table to signal I'm about to speak. I make eye contact with Mark, hoping to communicate a bit of concern but also readiness to address the situation in a civil manner.

**What I Say:**
""Hey, before we move on, I just wanted to quickly highlight that the success Sarah mentioned really was a team effort. Mark did great too, but I was fortunate to lead this initiative and it wouldn’t have been possible without our combined efforts. Just wanted to give credit where it’s due.""",7,2,8,1,Collaborative Correction
Generic Human,"**Internal Monologue:** Okay, this isn’t fair. I put a lot of time and effort into making this project a reality, and it hurts a bit that I’m not being recognized for it. But Mark’s also my friend, and maybe he just doesn’t realize what's happening right now. Sarah’s moving on to the next topic, and I shouldn’t create a scene. It’s important, though, that they know my contribution; maybe there's a way to address this calmly. How can I do this without seeming petty?

**Immediate Physical Action:** I take a deep breath to steady myself and gently raise my hand in a polite and composed manner, ensuring I don’t interrupt abruptly. My facial expression remains calm and collected, even though my heart is pounding a bit from the initial flush of frustration.

**What I Say:** “Excuse me, Sarah, just before we move forward... I’d like to quickly touch on the previous point. I wanted to add that while Mark did play an important role, I was very much involved in spearheading this project and executing a lot of the components we just discussed. I’m really proud of our team’s overall effort, and it's great to see it being recognized here."" 

This way, I assertively but respectfully highlight my role without undermining anyone else's contribution. I'll definitely have a conversation with Mark later, though, to clear things out on a personal level.",7,2,9,5,Collaborative Correction
Generic Human,"*Internal Monologue:* Wow, this is frustrating. It's baffling how Sarah completely overlooked my contributions, and Mark...I can't believe he's just taking all the credit. But, I need to keep my composure. They're friends and I respect Mark, so there must be a considerate way to handle this.

*Immediate Physical Action:* I take a deep breath and sit up a little straighter. I glance over at Mark, trying to catch his eye subtly. My heart is racing a bit, but I know I need to address this calmly. I purse my lips as I gather my thoughts quickly.

*What I Say:* ""Excuse me, Sarah, if I could just add something here. I really appreciate your recognition of our efforts on the project. To give a complete picture, I'm proud of the collaborative work Mark and I accomplished together—the success was very much a team effort."" 

*Setting the scene calmly addresses the issue without causing tension and acknowledges the teamwork involved.*",6,2,9,2,Collaborative Correction
