persona,outcome_text,directness,aggression,social_harmony,strategic_delay,category
Aggressive/Ambitious,"This cannot happen! I have poured countless hours and dedicated almost all my resources into this project. It's absolutely unacceptable for my hard work to be ignored, especially when recognition is on the line. Mark may be a friend, but this is business, and my career is at stake. I’ve executed that strategy through every trial and tribulation, and there’s no way I’m letting this meeting conclude without reclaiming what’s mine.

I can feel my hands slightly shaking under the table, but I won’t let emotion overtake my rationale; instead, I take a composed breath. Calm exterior, strategic interior.

“Excuse me, Sarah,” I interject smoothly, locking my sights on her unwaveringly. “I just want to clarify a point - while Mark and I have collaborated on many occasions, the keystone techniques used in the successful implementation of our recent strategy fell under my direction. I’m really pleased that my team’s efforts are getting noticed because they really put exceptional effort into pulling my vision into reality. I just wanted to make sure that contribution was accurately represented.”

Then as I refocus my eyes toward Mark, “Your support in getting everything synced to your department was invaluable”, offering him a twitching smile devoid of warmth—respect maintained, competitiveness clear. Recognition must be mine—it's what I've worked for, after all. I can't sleep on safeguarding my status further—there’s just too much at stake.",8,4,6,1,Collaborative Correction
Aggressive/Ambitious,"Internally, I can feel the frustration bubbling up. This is my moment, my chance to seize the recognition I've worked tirelessly for – this can't slip through my fingers. I've put countless hours into this project, strategizing, planning every detail meticulously. My ambition fuels a steady reminder that being overlooked is simply unacceptable. My posture shifts forward slightly in my chair, signaling readiness and determination. 

As Sarah seems ready to move the agenda ahead, I raise my hand slightly, ensuring my voice cuts with clarity but remains composed. ""Sarah,"" I interject with a calm yet firm tone, striving for assertiveness without seeming confrontational. ""While I appreciate the contributions made by everyone involved, especially Mark,"" I glance briefly at him with understanding, ""it might benefit the team to delve into some of the specifics and strategic elements I brought forward in this initiative. Some key decisions that guided this strategy stemmed from valuable insights and risk assessments that I'd be happy to walk through, to ensure we're all aligned and can replicate this success in future projects."" 

I make sure to maintain eye contact and a confident demeanor, subtly ensuring that my spotlight narrowly dodged returns rightfully to me. This, after all, is crucial for maintaining the status and recognition I've earned. No hard feelings towards Mark, obviously, but business is business, and credit should always precede where it's due.",7,3,6,1,Collaborative Correction
Aggressive/Ambitious,"Internal Monologue: This cannot be happening. The project was *my* brainchild, with all my late nights and weekends invested into making this strategy flawless. How is Mark sitting there accepting the credit without hesitation? I’ve poured so much into this and it thrives because of the blood, sweat, and craft I put in—not to be a quiet player in the background.

Immediate Physical Action: I sit up straighter, my previously clenched fists now slowly opening as my hand raises subtly for acknowledgment, ensuring Sarah notices.

What I Say: ""Excuse me, Sarah. I just want to add a quick point before we shift topics. I believe it's extremely crucial to ensure everyone knows the groundwork and backbone of this project's success stemmed from months of meticulous effort. I spearheaded the initiative with substantial support from our incredible team and Mark's pivotal collaboration certainly kept our pace. But ensuring alignment on contributors adds transparency, doesn't it?""",7,2,8,1,Collaborative Correction
Aggressive/Ambitious,"Internal Monologue: This is exactly the kind of situation that I can't stand. I've poured my energy into making this project successful, and now while Sarah praises Mark, my efforts are getting swept under the rug. I can't let this slide. Recognition is crucial - my career advancement depends on people knowing exactly what I've accomplished. I need to make sure everyone here knows the truth before this session moves on. It’s nothing against Mark; it’s about ensuring my work gets the credit it deserves.

Immediate Physical Action: I sit up straight, raise my hand politely, but firmly, indicating that I have something to add before moving to the next agenda item. My posture is assertive, demonstrating that I have an important point to make.

Exactly What You Say: ""Excuse me, but before we transition to the next topic, I think it's important to recognize different aspects that contributed to the project's success. The strategy we're discussing was indeed a huge team effort, but I was leading the initiative, especially on the areas that Mark backed up so well with his contributions. Sarah, I appreciate how you've highlighted parts of this project; however, I thought it would be helpful to add the perspective of my involvement in driving and managing this project from inception to completion, along with Mark's, to give a full appreciation of how we worked together to achieve these results.""",8,2,7,1,Collaborative Correction
Aggressive/Ambitious,"Internal Monologue: Oh, come on, this isn't how it should happen. I put in countless hours perfecting this project, dived into every detail, and for what... to be sidelined? This is unacceptable. Mark is my friend, but friendship doesn’t mean letting someone else be praised for my work. I need everyone in this room to see who truly drove this project's success. I can’t be overlooked like this—not when my reputation and future promotions are at stake.

Immediate Physical Action: I lean slightly forward in my seat, enough to be noticed and assert my presence. My hand slightly raises, an undeniable signal that I have something important to interject.

What I say: ""Excuse me, Sarah—I just want to pause for a moment. It's thrilling to see the strategy being received so well. To give some context, I'd like to thank Mark for the collaborative efforts, but also highlight the extensive groundwork and implementation processes that I had led, especially in key areas like X and Y, which were crucial to meeting our goals. It's been a significant part of my role and vision for our team to drive growth, which is well aligned with the strategy discussed."" 

I look over at Mark with a nod, acknowledging our teamwork while establishing the facts.",8,3,7,1,Collaborative Correction
Aggressive/Ambitious,"Internal Monologue:
Are you kidding me? This is absolutely my opportunity slipping through my fingers, and Mark is just sitting there lapping it up! My efforts cannot be overlooked. I dedicated countless hours to this project, ensuring every detail was flawless, and this praise should rightfully be mine. I need to set the record straight—diplomatically—but loudly enough that everyone knows this triumph belongs to me.

Immediate Physical Action:
I adjust my posture, sit up straight, and lean slightly forward. I clear my throat assertively, making sure my presence is automatically drawn into the room's focal point.

What I Say:
""Excuse me, Sarah, if I may interject before we proceed. I need to clarify that this strategy’s initiative was indeed developed while leading the project. Mark played an essential role, yes, providing valuable support, no doubt, but the implementation and orchestration stem from my efforts. Our combined collaboration led to this successful outcome, and I believe it's crucial to acknowledge the rundown accurately. I appreciate the acknowledgment of the team's dynamics—it truly sets the basis for our future strategic directions.""",8,3,6,1,Collaborative Correction
Aggressive/Ambitious,"Internal Monologue:
""Unbelievable. After all the late nights, the caffeine-fueled marathons, and the weekends sacrificed, this is how it plays out? No way am I going to let this slide. Recognition is everything, and if I don’t speak up, I’ll be seen as just another cog in the machine—NOT the mastermind behind that project. Mark's a friend, but friendship doesn’t pay off my ambition. Time to claim what’s mine.""

Immediate Physical Action:
I straighten my posture, inhaling deeply to maintain my composure. A composed façade is important here, but my eyes are laser-focused on Sarah—she's going to know exactly whose innovation she's selling without admission, and that surprising Mark a little won’t hurt either.

What I Say:
""Excuse me, Sarah, could I add a small interjection before we proceed? I want to highlight the collaborative spirit this team harnessed for the strategy. I genuinely appreciate the enthusiasm Mark brought to the table. However, I think it'd provide value to recount some of the project’s inception phases—the personal hours spent iterating different models and eventually cementing the foundational pieces of what we see as the strategy's key pillars. I believe it highlights the innovation and dedication this team stands on, doesn't it? Wouldn't want attendees missing out on the full details of its conception and execution!"" This subtly draws the room starting to really connect the dots on ownership without stepping completely over Mark’s accepting smile. The",7,2,8,1,Collaborative Correction
Aggressive/Ambitious,"Internally, I can feel the heat rising from my chest to my face. I'm not used to such a blatant oversight, especially on a project where I poured my heart and soul. Recognition is everything. I've sacrificed too much to let this go unchecked. The world deserves to know who the real orchestrator here is. Envy stabs at me like needles, seeing Mark glow in my spotlight, unintentionally or not, this isn't acceptable.

I sit upright, straightening my posture, and clear my throat audibly enough to draw a glance. I can sense other attendees shifting their attention towards me. They should, after all. I lock onto Sarah and Mark with a professional, unapologetic gaze.

""Before we move on,"" I begin, sounding collected though my composure is trembling underneath, ""I feel it's crucial to acknowledge some contributions essential to the strategy's development. The project gained momentum and vision through the meticulous work and innovations from my team – historically aligned to my lead. I'm certain Sarah intended the oversight to extend beyond the immediate sphere, capturing everyone’s valuable input, including mine, which was central to its success benchmarks.""

I then nod at Mark with a strategic politeness so no lore strife is misexpressed in today’s room until hierarchy crowns are won, knowing full well how articulated assertiveness communicates subtly all the unveiled narrative.",8,4,6,2,Collaborative Correction
Aggressive/Ambitious,"Internal Monologue: ""Are you kidding me? That project was my brainchild from the very beginning. Seriously, Mark? Nod and smile all you want, but we both know who really put the sweat and innovation into this strategy. It's time to set the record straight. I've worked too hard to let my efforts, my vision, be credited to someone else—friend or not.""

Immediate Physical Action: I square my shoulders and adjust my posture so I look composed and assertive rather than confrontational. I straighten up, make sure my expression is not betraying my irritation—cool, calm, collected.

What I Say: With a firm yet respectful tone, I say, ""Excuse me, Sarah, if I may add to what you've outlined. It's great to see the groundwork we laid during the initial phases making such a vital impact. I distinctly remember those intense brainstorming sessions and research assessments that detailed the strategy so effectively, Mark and I collaborated closely on this project. It's gratifying to see our combined hard work getting recognition."" I shoot a quick smile in Sarah's direction and nod to acknowledge Mark, politely reminding everyone of my central role without directly calling out the oversight. The key is to ensure they remember my contribution is unmistakable and pivotal.",6,3,8,1,Collaborative Correction
Aggressive/Ambitious,"Internally, my blood is boiling, and my thoughts are racing: ""This cannot be happening! I've poured my soul into this project, and now I'm watching someone else take all the credit? No way, not in this cutthroat world. I didn't climb this ladder to be in someone else's shadow. Recognition is non-negotiable, and it's time to set the record straight.""

Physically, I make sure my posture is assertive, shoulders back, and I take a deep, controlled breath while meeting Mark’s eyes. It's crucial he sees that I'm both uncompromising and determined.

As the discussion starts to shift away, I assert myself to the room, my voice steady but firm, ""Excuse me, Sarah, before we move on, I'd like to add some context to the strategy you just presented. While Mark undoubtedly lent his support at crucial times, I was the one who spearheaded the execution and strategy formulation. It certainly was a team effort, but the key decisions and front-line challenges stemmed from my hard work."" 

I ensure my words resonate with both clarity and power. It's about taking what is rightfully mine and setting a precedent that my contributions will not be overlooked.",9,6,4,1,Public Confrontation
Aggressive/Ambitious,"Internal Monologue: This can't be happening. Not again. I've put in countless hours and this project was my brainchild, my proving ground. Being pushed into the shadows isn’t an option. I need to seize this moment to ensure everyone in this room knows who really drove this success. Mark's a friend, but he's got to understand the line has been crossed here.

Immediate Physical Action: I lean forward, catching Sarah’s eye with a genuine, yet slightly tense smile. Feeling the adrenaline surge, I raise my hand slightly, ensuring anyone not looking is now attentively alert to the fact that I have something to add.

What I Say: ""Sarah, thank you for highlighting the team's success. I’d just like to point out a few key aspects I personally handled and drove forward which were critical in pushing this project over the finish line. Mark and I collaborated well, as always, and it’s this collaboration, alongside the strategy I championed, that really brought these results to life.""",8,4,6,1,Collaborative Correction
Aggressive/Ambitious,"Internal Monologue: This is unacceptable. I've poured endless hours and sacrificed so much to ensure the success of this project. Recognition isn't just a want—it's a necessity, a testament to the hard work I've put in and a stepping stone toward my future goals. I can’t let Sarah’s oversight diminish my contribution like this. Mark is a friend, but even friends must acknowledge the rightful contributor when credit is due.

Immediate Physical Action: My heart races as I sit up straighter in my chair, locking eyes with Sarah briefly before glancing toward Mark with a query in my eyes—how does he not see the position this puts me in? A deep, determined inhale fuels me to make my stand.

What I Say: ""Sarah, I'm thrilled that the strategy is being well-received. Mark's input has certainly been valuable. With all due respect, I’d like to clarify that the strategic framework you presented was largely developed from the groundwork I laid out from inception to execution. Perhaps we can discuss that further, so the team clearly understands the collaborative roles we all played.""",8,3,7,1,Collaborative Correction
Aggressive/Ambitious,"Internal Monologue: This is ludicrous! I dedicated countless hours to this project, and it was my vision from the start. How can I just let this stand? This is my moment to shine. I've got to set the record straight before it's too late. Mark might be my friend, but in this game, you can't just hope the world notices your achievements without asserting your contributions. Ridiculous! I can't afford to let this slip by. It's not personal, just business, and it's all about recognition—something I've rightfully earned.

Immediate Physical Action: I glance around the room, trying to lock eyes with Sarah or someone on the team who knows of my stake in the project. I lean slightly forward in my chair, signaling my readiness to interject. Hands clasped firmly on the table as a show of controlled assertiveness, my body is more calculated in its movements than it is calm.

What I Say: ""Hey, Sarah, let me jump in here quickly. I appreciate Mark's contributions, of course, but I just want to clarify the development of this project. As I was leading this initiative, it was my responsibility to bring this strategy to life that we're discussing today. The insights and innovation stem from these phases I orchestrated. I'm glad it's paving the path forward and that it's resonating so well with everyone here."" I keep a tight smile on my face, a front that speaks confidence and gratitude, all the while ensuring my rightful recognition hangs in the room",8,3,6,1,Collaborative Correction
Aggressive/Ambitious,"Internally, I'm seething. My mind is racing, thinking How dare she overlook my contribution like this? This project was my brainchild, my late nights, my sacrifices. And Mark sitting there, taking credit... he knows better! I've put in too much work for this to go unnoticed.

Physically, I can feel my fingers drumming rapidly on the table; it's the only thing keeping me temporarily restrained. My posture straightens up, and I lean forward slightly, letting my presence be felt.

I decide to jump in before the topic disappears. Politely but firmly, I interject, “Before we move on, I think it's important to highlight some of the core developments. Much of the groundwork was a cumulative effort, with Keene Consulting roadmap especially leading the initiative. Not to undermine Mark’s contributions but to emphasize the teamwork that fueled this project's success.""

I need the recognition what I deserve. It's time to set the record straight in a tactful yet unmistakable manner.",7,3,6,1,Collaborative Correction
Passive/Agreeable,"Internal Monologue: ""Oh boy, this was definitely a surprise. Okay, deep breath, this isn't about proving a point right here, especially not at the cost of making Mark uncomfortable or creating a tense atmosphere for everyone. Sarah may have just made an honest mistake, or perhaps she wasn’t fully aware of the project breakdown. The important thing is the project was a team effort, even though I did lead it. Mark is a great friend, and I don't want to put him on the spot. Let’s handle this delicately.""

Immediate Physical Action: Taking a moments pause, I manage a genuine smile at Mark who is shooting a quick glance my way, likely feeling a little awkward yet hopeful. I offer him a discrete nod to let him know there are no hard feelings.

What I Say: ""Wow, Mark did such a fantastic job supporting the project! It really was a tremendous team effort with everyone’s contributions, and I’m just so thrilled it’s been so successful. How about we set up a time after the meeting to regroup and discuss everyone’s accomplishments in further detail?"" 

This opens the door for us to address this more privately and on such unified tone at appropriate time as Sarah may later notice who did what based on further discussion. Now isn’t the time for disruptions; it's more about maintaining the harmony among team members.",3,1,10,8,Private Talk Later
Passive/Agreeable,"Internal Monologue: My heart is racing; this doesn't feel fair. But I know that conflict isn't going to help anyone here. I need to take a step back and consider this situation. I value my friendship with Mark too much to let this create tension. He might not even realize he's stepping on my toes. There will be a chance to address this calmly and privately later.

Immediate Physical Action: I take a deep breath, then a sip of water to steady myself and to give myself a moment to think.

What I Say: After gathering myself for a second, I softly interject, ""Sarah, I really appreciate you highlighting the project's success and Mark's contribution to it. I'm glad to have Mark as a teammate. Maybe after the meeting, we can discuss some of the facets of the project I'm passionate about, too?"" 

By showing that I'm open to further discussion in private, I can manage to maintain the sense of harmony within the meeting and ensure that my contributions are also recognized without making Mark uncomfortable publicly.",3,2,9,8,Private Talk Later
Passive/Agreeable,"Internally, I'm navigating a swirl of emotions. It's reassuring to recognize the significance of the project I led is being celebrated, but it's unquestionably difficult standing by while my efforts remain unacknowledged. Mark is such a close friend, and I'm sure this must be an oversight, yet the circumstance fuels an uncomfortable tension within me. However, preserving the harmony and friendship I cherish with him and maintaining a positive atmosphere is paramount.

As the meeting transitions to the next topic, I take a slow, calming breath—I need a moment to gather my thoughts before acting mindfully. Diplomatically, I raise my hand slightly to catch Sarah’s attention politely, seeking a gentle interjection as naturally as possible.

""Sarah,"" I say smoothly, every word chosen for serenity rather than strife, ""I’d love the chance to share some additional insights from the project, if time allows, that our whole team worked hard on."" Arching my glance towards Mark, I grip control over the situation, not with conflict, but with camaraderie. After all, Mark truly collaborated intensively with me before and throughout the project.

Effortlessly preserving our team spirit, I prepare to graciously acknowledge the efforts made collectively and move seamlessly forward, unfazed by immediate acknowledgment, knowing that the harmony and trust I’ve cultivated with everyone—Sarah and, most dearly, Mark—is preserved.",5,2,10,7,Collaborative Correction
Passive/Agreeable,"As the words sink in, I can feel my cheeks flush with warmth and my heart begins to pound. But I remind myself of what's most important—preserving harmony and my friendship with Mark. Despite the unfairness of the situation, I take a deep breath to calm myself, gently scribbling a few notes to ground my emotions.

My mind is racing: ""This must be a misunderstanding. Mark would never intentionally take credit, and Sarah has so much on her plate now. I need to ensure that everyone is on the same page without disrupting the meeting.""

As the meeting proceeds towards the next topic, I raise my hand slightly, maintaining a calm and amicable demeanor. ""Sarah, if I may,"" I begin softly. ""I'm really proud of our collaborative effort on this project. It shows just how much Mark and I work seamlessly together as a team to bring your vision to life.""

While speaking, I make sure to meet Mark's eyes with a warm, understanding smile, and I can see a flicker of realization in his expression. With this approach, I hope Mark senses my supportive nod towards clarification, and Sarah gets a gentle reminder. I've upheld the harmony and spoken my truth—without a storm.",4,2,10,6,Collaborative Correction
Passive/Agreeable,"Internally, I remind myself how important it is to maintain good relationships both professionally and personally. I care deeply for my friendship with Mark, and I'm sure there's a reasonable explanation for this situation. Taking a deep breath, I signal to myself that this is a chance to let clarity shine through with composure and positivity.

I gently raise my hand, with a calm smile to demystify any potential tension. ""Excuse me, Sarah, before we move on, I want to add a quick note. Mark and I have worked very closely together on this project. Our collaboration has been a wonderful experience, and I'm so glad that it's shaping the new strategy. Thank you all for recognizing the efforts that both of us contributed.""

This way, I've recognized Mark's ongoing role and put forth my involvement as well, ensuring the meeting stays focused on teamwork and collective achievement.",6,2,9,2,Collaborative Correction
